{"created": "2026-09-15T03:45:00.000Z", "gates": ["node scripts/verify-migration-versions.mjs", "each my_*/get_my_* function verified to use auth.uid() (grep evidence in log)"], "goal": "Audit the self-read functions that SHOULD stay authenticated-callable (they enforce per-user scoping via auth.uid()): get_my_coin_balance(), get_my_coin_refunds(), get_my_crown_balances(), get_my_crown_converts(), get_my_eligible_crown_lots(), get_my_refundable_lots(), my_clan_usage(), my_compute_usage(uuid), my_fal_usage(), my_friends(), my_game_play_usage(), my_meshy_spend(), my_newgameplus_spend(), my_openrouter_usage(), my_outscraper_usage(), my_submission_spend(), my_team_perms(uuid), my_vault_spend(), my_vcw_usage(), love_me(), kid_wallet_balance(uuid) [also in 07 scope: revoke anon here if 07 kept it], update_bot_key_policy(uuid,text,timestamptz,boolean,integer,numeric,numeric,integer,boolean,numeric,numeric,text,text[],text[],text[],integer,text), vocrehab_export_snapshot(), vocrehab_log_export(text,integer). For each: (a) revoke anon via migration 20261219000007_security_self_reads.sql, (b) VERIFY body references auth.uid() (grep the CREATE FUNCTION source); if a function does NOT scope by caller identity, revoke authenticated too + QUEUE flag. File one accepted-risk QUEUE line per function kept authenticated-callable (needed for the authenticated-* WARNs to be knowingly accepted). Done = migration + per-function verdicts in log + green gate.", "id": "DS-SECWARN-08", "lane": "infra", "log": ["2026-09-15T03:45:00.000Z secwarn-lead: envelope created, awaiting claim.", "2026-09-15T04:10:00.000Z secwarn-08: claimed (in_progress, owner=secwarn-08).", "2026-09-15T04:30:00.000Z secwarn-08: audit verdicts PASS(23, anon revoked + authenticated kept in NEW 20261219000009_security_self_reads.sql): get_my_coin_balance [where user_id=auth.uid() 20260910000000:139, lots-based 20260911000000:102]; get_my_coin_refunds [where r.user_id=auth.uid() 20261012000000:236]; get_my_crown_balances [4x auth.uid() 20261019000000:139-147]; get_my_crown_converts [where user_id=auth.uid() :523; zero app callers]; get_my_eligible_crown_lots [where user_id=auth.uid() :164; zero app callers]; get_my_refundable_lots [guard+where l.user_id=auth.uid() 20261025000007:29/48]; my_clan_usage [guard+5x auth.uid() 20260917000000:94-129]; my_compute_usage(uuid) [guard+6x auth.uid() 20260917000000:23-75; app my/usage]; my_fal_usage [guard+4x auth.uid() 20260920000000:153-184; app my/usage]; my_friends [requester/addressee=auth.uid() 20260910020000:53; app social/friends]; my_game_play_usage [guard+8x auth.uid() 20261022000000:336-383; app my/usage]; my_meshy_spend [guard+auth.uid() 20261013000000:434-436; app my/usage]; my_newgameplus_spend [guard+auth.uid() 20261022000000:122-124; app my/usage]; my_openrouter_usage [guard+6x auth.uid() 20261202000000:341-439; app openrouter-vendor/usage]; my_outscraper_usage [guard+6x auth.uid() 20261202000000:398-439; app outscraper/usage]; my_submission_spend [guard+auth.uid() 20261013000000:422-424; app my/usage]; my_team_perms(uuid) [null-guard+5x auth.uid() 20260925000100:127-140; app squads perms]; my_vault_spend [guard+auth.uid() 20261013000000:446-448; app my/usage]; my_vcw_usage [guard+3x auth.uid() 20261020000000:234-256; zero app callers]; love_me [where p.id=auth.uid() 20261001000000:91; app love/me]; update_bot_key_policy(18-arg) [guard+where id=p_key_id and user_id=auth.uid() 20260929000100:130/207; zero app callers]; vocrehab_export_snapshot [v_uid:=auth.uid()+16x scoped 20261208000000:369-388; zero app callers yet]; vocrehab_log_export(text,integer) [guard+values(auth.uid()) 20261208000000:400-404; zero app callers yet]. FAIL(1, authenticated REVOKED too in 09 file + QUEUE flag): kid_wallet_balance(uuid) [body where kid_id=p_kid ONLY, zero auth.uid() 20260924000002:152-156; REAL BUG; service_role kept; adjacent kid_seconds_today same flaw flagged for 07].", "2026-09-15T04:35:00.000Z secwarn-08: gates: (1) node scripts/verify-migration-versions.mjs FULL-TREE RED EXTRINSIC: Duplicate 20261219000000 (linter_search_path vs security_search_path; both untracked sibling files, git status ??) throws before any later file; further queued collisions 01x3/02x3/03x2/04x2/05x2/06x3/07x2/08x3 all untracked siblings, none mine. SCOPED exact-logic re-run over 129 git-tracked + my 09 file = SCOPED-OK 130 unique, my 09 collides with nothing. (2) guard-rule re-run on my file = GUARD-OK (REVOKE/GRANT only). (3) self-grep 24/24 signatures carry REVOKE lines, 0 grants to anon. Migration file: v2/vcw4w/supabase/migrations/20261219000009_security_self_reads.sql (deviation from envelope 07 documented in header + QUEUE: 06/07/08 all occupied). QUEUE: 23 accepted-risk lines + version-deviation + security-flag + 3-way grant-conflict lines filed. Envelope set blocked-honest: scope GREEN, unblocks to done when steward reconciles migration versions globally."], "owner": "secwarn-08", "scope": ["v2/vcw4w/supabase/migrations/20261219000007_security_self_reads.sql"], "status": "blocked", "title": "Secwarn 08: self-read RPC audit + anon revoke", "updated": "2026-09-15T03:45:00.000Z"}