{"created":"2026-09-15T04:30:00.000Z","gates":["node scripts/verify-migration-versions.mjs","node scripts/verify-devswarm.mjs"],"goal":"Lint 0028/0029 fixed for ORG/TEAM/ROLE-domain functions: REVOKE FROM anon always; FROM authenticated only where app never calls .rpc(name) (grep v2/vcw4w/app lib components; service_role server callers unaffected). Set: bump_org_member_count, enforce_org_budget, enforce_org_count, enforce_org_member_cap, enforce_personal_budget, trg_init_org_on_use, trg_init_team_org_on_use, ensure_default_org, ensure_org_initialized, has_org_perm, has_project_perm, has_team_perm, is_org_member, effective_perms, org_member_cap, org_roles_of, org_watch_visible, org_roster, org_roster_page, org_scale_status, create_org, create_team, create_project, set_member_role, set_member_roles, set_my_budget, set_org_budget, set_org_prune_settings, set_watch_scope, set_self_host_seats, create_custom_role, create_org_invite_link, list_org_invites, redeem_org_invite, revoke_org_invite, prune_org_members, buy_org_headroom, fund_org_wallet, team_org, project_team, party_can_act, party_can_admin, party_entity_exists, party_feed, party_label, party_resolve, party_search, party_follow, party_unfollow, party_post_create, party_my_invites, party_invite_create, party_invite_decide, party_challenge_create, party_challenge_decide. Exact signatures from definitions. Trigger/helpers revoke from public,anon,authenticated. Follow timer_ownership REVOKE/GRANT pattern. REVOKE-only. Reviewer runs both gates green.","id":"DS-SQLINT-04","lane":"infra","log":["2026-09-15T04:30:00.000Z sqlint-lead: envelope created (CHEAP wave, 1-file-per-agent rule), awaiting claim.","2026-09-15T05:00:00.000Z sqlint-04: claimed (status open->in_progress, owner sqlint-04).","2026-09-15T05:20:00.000Z sqlint-04: wrote supabase/migrations/20261219000003_sqlint_revoke_org_team.sql (55 fns: 29 app-called grant authenticated, 26 internal revoke auth; .rpc grep evidence recorded). Gates RED at baseline and after my change (identical, pre-existing, out of scope): verify-migration-versions -> Duplicate migration version 20261219000000: 20261219000000_linter_search_path.sql vs 20261219000000_security_search_path.sql; verify-devswarm -> DS-SQLINT-02.json status 'blocked-honest' not in enum (sibling envelope). My version 20261219000003 is unique; file is REVOKE/GRANT-only. Status in_progress->blocked per red-gate rule."],"owner":"sqlint-04","scope":["v2/vcw4w/supabase/migrations/20261219000003_sqlint_revoke_org_team.sql"],"status":"blocked","title":"SQLINT revoke anon/auth on org/team RPCs","updated":"2026-09-15T04:30:00.000Z"}