{"created": "2026-09-13T23:40:00.000Z", "gates": ["npx tsc --noEmit (zero errors in scope)", "npx eslint on touched files"], "goal": "Meter desktop compute in coins: NEW app/api/desktop/metering/route.ts (quote endpoint: seconds x rate -> coins, 100 coins = $1, read-only) + NEW lib/desktop-metering.ts (rate table, quote math, spend-link builder pointing at the MCP/API path). NEVER write coin/ledger tables or touch lib/economy.ts (economy-owned) — file the debit RPC as a QUEUE request to economy. Reviewer: GET quote returns {coins, usd} math matching 100=$1 with 75/25 split fields.", "id": "DS-OCT-06", "lane": "desktop", "log": ["2026-09-13T23:40:00.000Z lead: envelope created, awaiting claim.", "2026-09-14T00:10:00.000Z oct-06: claimed (open->in_progress). Overlap check: DS-OCT-04 DONE (app/terminal + app/api/terminal, disjoint paths, fine); DS-DTOP-03 done (app/terminal/page.tsx+layout, no file collision, QUEUE coordination only); DS-SEC-DESKTOP blocked scopes app/api/desktop/** broadly but outside the DS-REM/DS-DESKTOP/DS-REMASTER stop-filter — proceeding ADDITIVELY under metering/** only, read-only of sibling desktop routes; no live DS-REM/DS-DESKTOP/DS-REMASTER touches app/api/desktop/**. Targets verified NEW (metering/** + lib/desktop-metering.ts absent).", "2026-09-14T00:20:00.000Z oct-06: DONE. Files: NEW lib/desktop-metering.ts (COINS_PER_DOLLAR=100, 75/25 split, rate table cpu 1/standard 2/gpu 5/pro 8 coins-per-min, quoteDesktopSeconds pure math, formatDesktopQuote mirroring formatCoinsQuote CLASSICS language, buildDesktopSpendLink deep-links only) + NEW app/api/desktop/metering/route.ts (GET ?seconds=&class= -> {seconds, rateCoinsPerMin, coins, usd, split:{creator,platform}} + usdEquivalent/coinsPerDollar/quote/spendLink/mcpSpendPath/debit-not_implemented; 400 on bad seconds|class, per-IP rate limit, zero DB reads, zero ledger writes). Reviewer math: ?seconds=3600&class=gpu -> ceil(3600*5/60)=300 coins, usd 3.00, split 225/75. lib/economy.ts + migrations untouched; debit RPC filed as QUEUE.md line to economy. Gates: npx tsc --noEmit exit 0 zero output (from v2/vcw4w); npx eslint lib/desktop-metering.ts app/api/desktop/metering/route.ts exit 0 zero output. No secrets, no balances logged, no old-v1. Sibling note: DS-DTOP-03 (dtop-3) done in terminal scope — zero file collision (disjoint paths), QUEUE coordination only."], "owner": "oct-06", "scope": ["v2/vcw4w/app/api/desktop/metering/**", "v2/vcw4w/lib/desktop-metering.ts"], "status": "done", "title": "Desktop metering quote API", "updated": "2026-09-14T00:25:00.000Z"}