{
    "created":  "2026-09-13T08:35:00.000Z",
    "id":  "DS-FEEDBACK-04",
    "goal":  "Outcome for DS-FEEDBACK-04: Micro photo editor draw label. See QUEUE.md feedback run goal.",
  "status": "done",
  "owner": "fb-04",
    "scope":  [
                  "v2/vcw4w/components/feedback/photo-editor.tsx"
              ],
    "updated":  "2026-09-13T08:35:00.000Z",
    "gates":  [
                  "npx tsc --noEmit",
                  "npx eslint"
              ],
    "title":  "Micro photo editor draw label",
    "log":  [
                "2026-09-13T08:35:00.000Z unassigned: envelope created from template, awaiting claim.",
                "2026-09-13T09:00:00.000Z fb-04: claimed envelope.",
                "2026-09-13T09:15:00.000Z fb-04: created components/feedback/photo-editor.tsx (client component: Blob|dataURL in, onDone(jpgBlob)/onCancel out; pointer-events overlay with touch-action none, draw+label modes, prompt label pins + list, undo/clear, JPEG composite export). Gates: npx tsc --noEmit clean (zero output, no photo-editor lines), npx eslint components/feedback/photo-editor.tsx clean (no output, ESLINT_EXIT True). Full tsc green at close. Status done."
            ],
    "lane":  "web"
}