{"created":"2026-09-13T14:20:00Z","gates":["npx tsc --noEmit","npx eslint app/mmo/page.tsx app/mmo/rent/page.tsx app/mmo/mmo-browser.tsx app/mmo/rent/rent-form.tsx"],"goal":"Pages live at /mmo and /mmo/rent: git-mv app/mmorpg/* to app/mmo/* (rename mmorpg-browser.tsx to mmo-browser.tsx, fix its import), update all in-file links/canonicals/fetch URLs from /mmorpg* and /api/mmorpg/* to /mmo* and /api/mmo/* (API move is pinned: DS-MMOMV-02 moves it, write callers against /api/mmo/*). Done = old dir gone, new routes render, both gates green with output in log, zero edits outside scope.","id":"DS-MMOMV-01","lane":"web","log":["2026-09-13T14:20:00Z lead: envelope created, awaiting claim.","2026-09-13T22:39:34Z mmomv-01: claimed, starting pages move","2026-09-13T22:56:27Z mmomv-01: git-mv 4 files app/mmorpg/* -&gt; app/mmo/* (mmorpg-browser.tsx renamed mmo-browser.tsx); in-file updates: MmorpgBrowser-&gt;MmoBrowser import+export+usage, canonicals /mmorpg-&gt;/mmo and /mmorpg/rent-&gt;/mmo/rent, href /mmorpg/rent-&gt;/mmo/rent, fetches /api/mmorpg/quote|rent-&gt;/api/mmo/quote|rent, comments /mmorpg*-&gt;/mmo*, ../mmorpg-browser import-&gt;../mmo-browser; old app/mmorpg dir removed from disk (was empty post-mv). Intentionally kept: MmorpgRealm type name (exported, no external importers) + mmorpg:* interop event strings (cross-lane bus listeners may depend on exact types). Repo-wide grep mmorpg-browser: zero live-code importers of old paths (only historical TASK JSON logs).","2026-09-13T22:56:27Z mmomv-01 GATE tsc: npx tsc --noEmit exit 0, zero output repo-wide.","2026-09-13T22:56:27Z mmomv-01 GATE eslint: npx eslint on 4 scope files exit 0, zero output.","2026-09-13T22:56:27Z mmomv-01: done (old dir gone, gates green, zero edits outside scope). Follow-ups for steward/QUEUE (NOT touched): app/docs/mmo/player/page.tsx:61,70 + app/docs/mmo/host/page.tsx:70,115 still href /docs/mmorpg/* and cite /api/mmorpg/join|gate (docs-lane owned); app/terms + app/privacy + app/api/age-verify + app/api/vcw/mmorpg* mention mmorpg paths/tables (their lanes); app/api/mmo/* internals keep mmorpg_servers/mmorpg_sessions table + lib/mmorpg-economy names (API/economy lanes)."],"owner":"mmomv-01","scope":["v2/vcw4w/app/mmo/page.tsx","v2/vcw4w/app/mmo/mmo-browser.tsx","v2/vcw4w/app/mmo/rent/page.tsx","v2/vcw4w/app/mmo/rent/rent-form.tsx"],"status":"done","title":"Pages move /mmorpg → /mmo","updated":"2026-09-13T22:56:27Z"}