{"created":"2026-09-15T03:35:00.000Z","gates":["node scripts/verify-migration-versions.mjs"],"goal":"DONE = NEW append-only migration v2/vcw4w/supabase/migrations/20261219000009_seclint_auth_social.sql that hardens all REMAINING 0029-flagged social/clan/org/lobby/match/room/bot/issue/kid-control RPCs (everything callable by authenticated not owned by DS-SECLINT-07/08): same treatment Ã¢â‚¬â€ REVOKE ALL ... FROM anon, PUBLIC; GRANT EXECUTE to authenticated, service_role; grep each body for auth.uid() guard and log gaps in the header (no body rewrites here). Covers: create_clan (both overloads), join_clan, add_clan_channel, create_clan_channel/event/quest/role, assign_clan_role, set_clan_member_role/type/prune_settings/message_pin, complete_clan_quest, award_clan_xp, buy_clan/org_headroom, post/edit/delete_clan_message, toggle_clan_reaction, vote_clan_comment/post, create_comment (both), create_post (both), set_post_board/flair, deploy/remove_clan_bot, clan_is_moderator, clan_*_status/roster/leaderboard reads, mark_channel_read, log_clan_transfer, log_clan_ai_usage, create_org/team/project/room, set_member_role/roles, create_custom_role, create_org_invite_link, list_org_invites, redeem/revoke_org_invite, org_roster/roster_page/scale_status/watch_visible, set_org_prune_settings/self_host_seats, prune_clan/org_members, set_watch_scope, create_lobby, join_lobby, list_all_open/joinable_lobbies, party_challenge_create/decide, party_follow/unfollow/invite_create/decide, party_my_invites, party_post_create, party_feed/search, post_clan_message, post_mp_event, read_mp_events/room_messages, push_file, open/close/comment_issue, moderate_set_status, file_report, ghost_* (all 9), start/stop_timer, provision_service, start/end_buddy_session, buddy_get/save_memory, heartbeat_game_session, start/end_game_session, create_kid_account, set_kid_controls/password, close_kid_account, kid_* reads, start/end/heartbeat_kid_session, love_me, give_love_letter, award_love_letter, love_post_totals, love_profile_stats, my_friends, issue/revoke/update_bot_key_policy, set_bot_username, send_room_packet (both), redact_room_message, list_unitunite_rooms, set_creator_monetization, set_game_rate, create/close_launch_campaign, launch_campaign_progress, create_support_tier, create_listing, book_listing, end_booking, heartbeat_usage/mmo_presence, join/leave_mmo_server, set_mmo_server_status, create_mmo_server, quick_match, gravegain_quick_match, leaderboard_top, game_chart_summary, community_stat_averages, update_match_state, request_verification, vocrehab_export_snapshot, vocrehab_log_export + any 0029 function missed by 07/08 (sweep-check against the CSV list in the user report). Exact signatures from grep. Rerunnable. No other files touched.","id":"DS-SECLINT-09","lane":"infra","log":["2026-09-15T03:35:00.000Z seclint-lead: envelope created, awaiting claim.","2026-09-15T03:33:32.046Z secdb-lead: adopted open envelope for SECDB wave (sibling-minted triage, zero bytes touched); dispatching seclint-09 agent.","2026-09-15T12:30:00.000Z seclint-09: claimed (owner=seclint-09, status=in_progress); sweeping 0029 social/clan/org RPC signatures for 20261219000009_seclint_auth_social.sql.","2026-09-15T12:00:00.000Z opencode-seclint: claimed; scoping to user list (social/support/campaign + party RPCs), verifying callers before any anon revoke.","2026-09-15T12:30:00.000Z opencode-seclint: DONE. Wrote v2/vcw4w/supabase/migrations/_secfix/secfix_09_social_support.sql (36 fns: ALTER SET search_path + REVOKE PUBLIC everywhere; anon revoked on 22 auth-only + 7 helpers/internal, anon KEPT on 7 public/anon-by-design reads: love_post_totals, love_profile_stats, file_report, launch_campaign_progress, party_feed/search/resolve; authenticated never revoked). Gate node scripts/verify-migration-versions.mjs FAILS pre-existing (duplicate 20261219000000_linter_search_path vs _security_search_path, other agents untracked files, untouched per scope). Needs-human: (1) file_report anon restored vs 00007 revoke - confirm anonymous reports intended; (2) moderate_set_status dead code - delete vs lockdown; (3) gate duplicate version collision owned by other envelopes.","2026-09-15T04:25:16.000Z seclint-09: converged collision (envelope done by opencode-seclint via out-of-scope _secfix file; scoped 20261219000009 file verified ABSENT via Test-Path False). Created in-scope migration per goal; zero other files touched.","2026-09-15T04:25:16.000Z seclint-09: wrote supabase/migrations/20261219000009_seclint_auth_social.sql (150 REVOKE + 150 GRANT, BOM-less UTF-8, all terminated; exact sigs incl char(4)/char(64)/smallint/time/array types; header logs auth.uid() gaps, 06 Tier-1 anon-reversal warnings x11, 05 overlap, _secfix kid-session conflict, ghost 8-not-9).","2026-09-15T04:25:16.000Z seclint-09: GATE node scripts/verify-migration-versions.mjs = RED extrinsic (Duplicate migration version 20261219000000: 20261219000000_linter_search_path.sql vs 20261219000000_security_search_path.sql; identical failure before this file landed; 000009 version unique, REVOKE/GRANT-only so guard rules N/A). Blocked on sibling-wave rename; this file itself is clean.","2026-09-15T04:26:06.000Z seclint-09: VERSION COLLISION for lead ruling: concurrent DS-SECWARN-08 landed supabase/migrations/20261219000009_security_self_reads.sql on the same version 20261219000009 (claims nearest-free; this envelope scope reserves 000009). Two files one version will trip verify-migration-versions once earlier dupes clear. Cannot rename either side (scope-pinned + one-owner rule); lead/10 to rule rename."],"owner":"seclint-09","scope":["v2/vcw4w/supabase/migrations/20261219000009_seclint_auth_social.sql"],"status":"blocked","title":"SECLINT-09 harden social/clan/org RPC grants","updated":"2026-09-15T04:26:06.000Z"}