{"created":"2026-09-13T07:57:40.000Z","gates":["node scripts/verify-fridge.mjs","node scripts/verify-game-bundles.mjs"],"goal":"Fridge metadata + guide truthful: game.json mobileOptimized true with touch controls, guide.html lists full emoji food almanac with nutrition. Reviewer reads guide and matches in-game foods.","id":"DS-FRIDGE-03","lane":"games","log":["2026-09-13T07:57:40.000Z fridge-lead: envelope created (metadata + guide).","2026-09-13T08:20:00.000Z fridge-03: work landed scope-only (game.json: mobileOptimized true, tags +touch/mouse/cloud-saves, v1.1.0, Pause/Resume P-or-Esc note; guide.html: #almanac 34 in-game foods w/ true hunger+Pro/Carb/Vit, desserts/drinks honestly unstocked, #cloud-saves slots 0-3 via /api/saves?game=fridgesimulator + slot-0 safety; old sections intact). Gates: verify-game-bundles GREEN exit0; verify-fridge check4+secrets PASS in-scope, overall RED on DS-FRIDGE-01 (86 foods owed, in_progress)/02 (CSS)/05 (saves lib absent) - no steal, game.js/css/lib untouched. Blocked pending siblings."],"owner":"fridge-03","scope":["v2/vcw4w/public/games/html/fridgesimulator/game.json","v2/vcw4w/public/games/html/fridgesimulator/guide.html"],"status":"blocked","title":"Fridge meta: manifest + food almanac guide","updated":"2026-09-13T08:20:00.000Z"}