{"created": "2026-09-13T10:38:27.000Z", "gates": ["node --check public/games/html/gravegain5d-rpg.js", "node scripts/verify-gravegain5d.mjs stays green (no regressions)"], "goal": "RPG systems core lands as a new vanilla-JS mod for GraveGain5D: classes (Void Putter/Paradox Warden/Universe Drifter mirror of game.js CLASSES), stats HP/ATK, XP/levels, loot drops + inventory, dungeon progression across 6 universes, awardXP/kill-loot APIs for combat and golf-trial hooks. Reads window.GraveGain5D read-only. Reviewer runs node --check green and sees window.GraveGain5DRpg + GraveGainMods.push. Canon refs: public/games/gravegain5d/game.js, content/gravegain5d-modes.ts, public/games/html/gravegain-sidequests.js shape. No edits outside scope.", "id": "DS-G5D-02", "lane": "games", "log": ["2026-09-13T10:38:27.000Z lead: envelope created, awaiting claim.", "2026-09-13T10:52:13.000Z g5d-02: claimed + in_progress (scope file ABSENT verified 10:52Z).", "2026-09-13T10:58:00.000Z g5d-02: wrote public/games/html/gravegain5d-rpg.js (vanilla IIFE, window.GraveGain5DRpg + GraveGainMods.push gravegain5d-rpg). Gates: node --check clean (no output) + verify-gravegain5d OK 43 checks passed; smoke: newCharacter/awardXP/awardKillLoot/trialClear/clearDungeon/rollLoot OK, idempotent true. Zero writes outside scope."], "owner": "g5d-02", "scope": ["v2/vcw4w/public/games/html/gravegain5d-rpg.js"], "status": "done", "title": "GG5D theme fix: RPG systems (classes/XP/loot/dungeons)", "updated": "2026-09-13T10:52:13.000Z"}