{"created":"2026-09-13T14:05:00Z","gates":["npx tsc --noEmit","npx eslint app/api/presence/route.ts"],"goal":"PUT /api/presence never returns a bare 500: DB errors go through structured logging (code/message, no PII) and missing-table errors (42P01/PGRST205) return ok({recorded:false}) since presence is best-effort telemetry; real faults keep a 500 with server-side evidence. Done = route patched, both gates green with output in log, zero edits outside scope.","id":"DS-FIX500-01","lane":"web","log":["2026-09-13T14:05:00Z lead: envelope created, awaiting claim.","2026-09-13T22:26:17.1784892Z fix500-01: claimed, starting presence hardening","2026-09-13T22:27:44.5425074Z fix500-01: patched presence route (dbFail + missing-table fail-open ok recorded:false, mirror of me/activity). GATE npx tsc --noEmit exit 0 (no output). GATE npx eslint app/api/presence/route.ts exit 0 (no output). status->done"],"owner":"fix500-01","scope":["v2/vcw4w/app/api/presence/route.ts"],"status":"done","title":"Presence PUT: structured errors + fail-open","updated":"2026-09-13T22:27:44.5425074Z"}