{"created": "2026-09-13T10:38:27.000Z", "gates": ["npx tsc --noEmit clean on the new file", "npx eslint on the new file clean"], "goal": "Franchise codex lands as a typed TS module for GraveGain5D extending (never duplicating) content/gravegain5d-lore.ts: factions (Compact, Array, Mother Tree roots, Hades spares), key figures (Angel Good, Mirathiel, Groknak, Sable, Pell & Marrow, Vex, Null), six-universe entries, paradox/hop glossary, golf-as-trial doctrine. Reviewer reads codex entries keyed by id. No edits outside scope.", "id": "DS-G5D-07", "lane": "games", "log": ["2026-09-13T10:38:27.000Z lead: envelope created, awaiting claim.", "2026-09-13T10:54:00.000Z g5d-07: claimed (open->claimed). Scope ABSENT verified (gravegain5d-codex.ts missing; gravegain5d-lore/modes + gravegain-codex.js + gravegain4d-codex read).", "2026-09-13T10:54:00.000Z g5d-07: in_progress (claimed->in_progress). Writing ONE new module in scope only.", "2026-09-13T10:58:00.000Z g5d-07: wrote content/gravegain5d-codex.ts (24 entries: 4 factions/7 figures/6 universes/6 terms/1 doctrine; codexById+codexByKind; extends lore/modes by cross-ref, zero duplicated prose). Gates: tsc zero errors on new file (2 foreign pre-existing errors elsewhere, shifting between runs under concurrency: studio/audio-lab + food-batch-08), eslint clean on codex+lore+modes+4d-codex. in_progress->done."], "owner": "g5d-07", "scope": ["v2/vcw4w/content/gravegain5d-codex.ts"], "status": "done", "title": "GG5D theme fix: franchise codex content", "updated": "2026-09-13T10:58:00.000Z"}