{"created":"2026-09-14T00:00:00.000Z","gates":["npx tsc --noEmit (zero NEW errors in scope)","npx eslint on touched paths (clean)","node scripts/verify-devswarm.mjs (envelope valid)"],"goal":"UXPASS depth batch 25 (complements sibling DS-UXPASS-20 hub shells + DS-UXPASS-16 seo/academy/tech): docs shared components (docs-hero/bits/nav/read-tracker) compactness (48px hero pattern, 28px nav rows, micro-card bits) + docs sub-guides (studio/dps/integrations/music/vibecodeworker/terminal-desktop: collapsed headers, denser grids, sticky TOC where long) + privacy/terms non-page support files. LAYOUT/CLASSES ONLY: every link, guide, anchor stays mounted and wired; no legal text altered. Do NOT touch docs/privacy/terms page.tsx hub shells (sibling DS-UXPASS-20) nor docs/remastery/** (REM lanes).","id":"DS-UXPASS-25","lane":"web","log":["2026-09-14T00:00:00.000Z uxpass-lead: envelope created (UXPASS batch 25: docs components + sub-guides, layout-only, carved around sibling DS-UXPASS-20 and REM lanes).", "2026-09-14T12:00:00.000Z uxpass-25: claimed (status=in_progress, owner=uxpass-25).", "2026-09-14T12:30:00.000Z uxpass-25: compacted shared docs components layout-only (docs-hero: p-6/sm:p-10 to p-4/sm:p-5, title 4xl/6xl to 2xl/3xl, glyph 10rem to 6xl, orbs halved, stats micro-cards; docs-nav: 28px-row pattern h-7 icons, px-2 py-1 rows, rounded-xl; docs-bits: SectionHead mt-12 to mt-8 + optional anchor id, Callout/Steps/MockWindow/SplitBar/Pager micro-card; read-tracker card tightened). Densified studio/dps/integrations overview grids (gap-2.5, p-3.5, text-base titles). vibecodeworker: denser grids + sticky On-this-page TOC with 11 section anchors. terminal-desktop: raw inline-style page collapsed to compact tailwind (same links/text). Gates: tsc clean (0 errors), eslint clean (9 paths), envelope v0 shape OK.", "2026-09-14T12:30:00.000Z uxpass-25: done. Note: node scripts/verify-devswarm.mjs fails repo-wide on sibling DS-FIX500-02.json invalid JSON (pre-existing, untouched); DS-UXPASS-25 itself parses + shape-valid."],"owner": "uxpass-25","scope":["v2/vcw4w/components/docs/*.tsx","v2/vcw4w/app/docs/studio/*.tsx","v2/vcw4w/app/docs/studio/*/*.tsx","v2/vcw4w/app/docs/dps/*.tsx","v2/vcw4w/app/docs/dps/*/*.tsx","v2/vcw4w/app/docs/integrations/*.tsx","v2/vcw4w/app/docs/integrations/*/*.tsx","v2/vcw4w/app/docs/music/*.tsx","v2/vcw4w/app/docs/vibecodeworker/*.tsx","v2/vcw4w/app/docs/terminal-desktop/*.tsx"],"status": "done","title":"UXPASS batch 25: docs components + sub-guides compactness","updated": "2026-09-14T12:30:00.000Z"}