{"created": "2026-09-13T13:00:00.000Z", "gates": ["npx tsc --noEmit (zero errors in touched files)", "npx eslint on touched files"], "goal": "Play-persistence APIs audited and improved to support the QA sweep: app/api/saves/*, leaderboard, matches, cheats, stats, presence plus lib/save-*.ts and lib/leaderboard-*.ts keep the cheated-save invariant, age-gate writes, fail closed, never leak raw DB text. Fixes landed in-scope; cross-lane needs returned as text.", "id": "DS-GQA-10", "lane": "games", "log": ["2026-09-13T13:00:00.000Z lead: envelope created, awaiting claim.", "2026-09-13T22:58:21.000Z gqa-10: claimed, status open->in_progress, starting QA-fitness audit.", "2026-09-13T23:10:00.000Z gqa-10: done. Gates: tsc clean (0 errors), eslint clean (6 files), verify-save-slots green (checks 11-13 green). Fixes: cheats PUT dbFail+rpcFail; matches POST/[id]/events dbFail+rpcFail + split 404s; saves PUT cross-kind cheat branding; stats POST 403 cheat-guard. No writes outside scope."], "owner": "gqa-10", "scope": ["v2/vcw4w/app/api/saves/**", "v2/vcw4w/app/api/leaderboard/**", "v2/vcw4w/app/api/matches/**", "v2/vcw4w/app/api/cheats/**", "v2/vcw4w/app/api/stats/**", "v2/vcw4w/app/api/presence/**", "v2/vcw4w/lib/game-autosave.ts", "v2/vcw4w/lib/game-rent.ts"], "status": "done", "title": "GQA API lane 2 (saves, leaderboard, matches, stats)", "updated": "2026-09-13T23:10:00.000Z"}