{"created":"2026-09-15T06:30:00.000Z","gates":["node scripts/verify-migration-versions.mjs","node scripts/verify-devswarm.mjs"],"goal":"Reconcile lint 0029 clan-create RPCs (create_clan x2 overloads, create_clan_channel, create_clan_event, create_clan_quest, create_clan_role, create_comment x2, create_post x2) against 20261220000012. Ensure anon revoked + authenticated granted exactly where app .rpc callers exist (login-gated routes), both overloads covered. Land idempotent delta in 20261222000004 file.","id":"DS-SECFIX2-04","lane":"infra","log":["2026-09-15T06:30:00.000Z lead: envelope minted, awaiting claim.","2026-09-15T06:08:59.224Z secfix2-04b: claimed, starting reconcile of clan-create RPCs vs 20261220000012.","2026-09-15T06:11:59.362Z secfix2-04b: gates SPLIT - verify-migration-versions GREEN (168 files); verify-devswarm RED extrinsic on sibling TASKS/DS-SQLINT-02.json status blocked-honest (invalid enum, not my scope, untouched).","2026-09-15T06:11:59.362Z secfix2-04b: envelope blocked pending steward repair of DS-SQLINT-02; delta file stands as written."],"owner":"secfix2-04b","scope":["v2/vcw4w/supabase/migrations/20261222000004_seclint2_clan_create.sql"],"status":"blocked","title":"SECFIX2-04 clan creates","updated":"2026-09-15T06:11:59.362Z"}